subject,predicate,object,fe_id
Kentucky,contains administrative territorial entity,Bracken County,19962
Kentucky,contains administrative territorial entity,Campbell County,19962
Bracken County,located in the administrative territorial entity,Kentucky,19962
Campbell County,located in the administrative territorial entity,Kentucky,19962
Valerie Bradford,spouse,Robert Bradford,19962
Robert Bradford,spouse,Valerie Bradford,19962
shooting of a farmer,located in the administrative territorial entity,Bracken County,19962
